15,Yamborghini High (feat. Juicy J),Caroline,Transportin',No Sad No Bad,Tamale,Yikes,911 / Mr. Lonely (feat. Frank Ocean & Steve Lacy),Yes Indeed,"After The Storm (feat. Tyler, The Creator & Bootsy Collins)",Simple,Mis Deseos / Feliz Navidad (with Thalia),I. The Worst Guys,How You Feel,U Said,You & Me,Fuck Love,Caroline,I THINK,Je te veux,Don't Stop Me Now - Remastered 2011,I BEEN BORN AGAIN,"GONE, GONE / THANK YOU",GRoCERIES,Passionfruit,Gm Say It Back,Gm Say It Back,Forget Me Thots,One Night,Wouldn't Leave,Better,Ghost Town,GRoCERIES,Crazy,Green Light,Sum of My Cares,November,Like That (feat. Gucci Mane),Good Days,Won't Bite (feat. Smino),Stars Are Blind,Good Days,good 4 u,You Right,Oceanic Feeling,Domo23,Working for the Knife,National Anthem,Location,Passion,Babydoll,Garden Shed (feat. Estelle),White Horse (Taylor’s Version),A BOY IS A GUN*,NEW MAGIC WAND,RUNNING OUT OF TIME,Buzzcut Season,Hey Stephen (Taylor’s Version),ARE WE STILL FRIENDS?,The Great War,About You,Back To December,Garden Song,In Ha Mood,Bravado,Fearless (Taylor’s Version),Hold No Grudge - Bonus Track,West Coast,SORRY NOT SORRY,lacy,making the bed,American Teenager,Writer In The Dark,Roadkill,Christine,Garden Song,Forever,loml,Femininomenon,Better Man (Taylor's Version) (From The Vault),Midnight Ride,Summer Song,Oak Island,I Killed You,Nomad,Dancing Through Life,Apple,California,past life,party 4 u,GRWM,Fame is a Gun,Voyager,Kitchen,Audrey Hepburn,House Tour,Hampstead,intro (end of the world) - extended,WHARF TALK (feat. A$AP Rocky)
16,Uber Everywhere,Magnolia,Stir Fry,KEKE,Stir Fry,SWEET,Passionfruit,Kids See Ghosts,Electric (feat. Khalid),Life Changes,Feliz Navidad,Mind Your Manners (feat. Icona Pop),Caroline,Rollin (feat. Future & Khalid),Playinwitme (feat. Kehlani),Transportin',Powerglide (feat. Juicy J) - From SR3MM,Garden Shed (feat. Estelle),Control - Freestyle,Catch & Release - Deepend Remix,GRoCERIES,Ocean Man,nursery,LOYALTY. FEAT. RIHANNA.,Best Friend,Loner,Blinding Lights,Love$ick (feat. A$AP Rocky),Mr. Brightside,Don't Wanna Fall In Love,Glitter,ROXANNE,Landslide,Ride,BLEACH,"Sunflower, Vol. 6",Small Worlds,Drew Barrymore,"After The Storm (feat. Tyler, The Creator & Bootsy Collins)","After The Storm (feat. Tyler, The Creator & Bootsy Collins)","GONE, GONE / THANK YOU",Kiss Me More (feat. SZA),Solar Power,First Love / Late Spring,Beef FloMix,Red,Mr. Perfectly Fine (Taylor’s Version) (From The Vault),Stay Stay Stay (Taylor's Version),Nineteen,Mood Ring,Long Live,Superman,PUPPET,Perfect Places,Doin' Time,Television / So Far So Good,Buzzcut Season,hope ur ok,august,Stoned at the Nail Salon,Forever & Always (Taylor’s Version),Happy & Sad,Kill Bill,I Wish You Would,Stay Beautiful,could cry just thinkin about you - Full Version,Mean (Taylor's Version),We're In Love,Cate’s Brother,teenage dream,My Love Mine All Mine,Green Light,Margaret (feat. Bleachers),Love Ridden,Church (feat. Teddy Verseti),Close To You,so american,us. (feat. Taylor Swift),Pink Skies,emails i can’t send,Peter,Nomad,NASA,"Darling, I (feat. Teezo Touchdown)",No One Mourns the Wicked,ur so pretty,intro (end of the world) - extended,raindrops (an angel cried),"Sally, When The Wine Runs Out",Prisoner,"Henry, come on",Sex and the city,Sue me,Brother,bad idea,Midnight Sun,With Heaven On Top,Graceland Too
17,It's A Vibe,See You Again (feat. Kali Uchis),Break Up Every Night,iSpy (feat. Lil Yachty),Fireflies (Outro),See You Again (feat. Kali Uchis),November,Yikes,NO BYSTANDERS,Powerglide (feat. Juicy J) - From SR3MM,Let It Snow! Let It Snow! Let It Snow! (with The B. Swanson Quartet),Slide (feat. Frank Ocean & Migos),KOD,Topanga,OTW,Gassed Up,Tamale,Pothole (feat. Jaden Smith),Peace of Mind,Bubblin,Panini,"thank u, next",I BEEN BORN AGAIN,Feel Something Again,Phone Numbers,Salad Days,Knock Knock,iSpy (feat. Lil Yachty),NONSENSE,After Party,Gutter Girl,Novacane,Watermelon Sugar,The Spins,Small Worlds,Ribs,New Light,Supermodel,IV. Sweatpants,Hell N Back,Bubblin,JUGGERNAUT (feat. Lil Uzi Vert & Pharrell Williams),Nobody,Fallen Fruit,Need to Know,Peach,Empty,Class of 2013,champagne problems,Dominoes,Lover,The Story Of Us,Supercut,"OPEN A WINDOW (feat. Tyler, The Creator)",Daylight,Ride,Ribs,PUPPET,cardigan,Moon Song,DVD Menu,this is me trying,The Kiss Of Venus (Dominic Fike),I Did Something Bad,Cool About It,Kamikaze,Speak Now (Taylor's Version),Letter To An Old Poet,Rush,I'm Your Man,Revolution 0,Roadkill,Cool About It,Butterflies,The Trapeze Swinger,obsessed,Casual,How Did It End?,so american,Sweet Life,28,Risk,supernatural,Free Now - Live From Vevo,St. Chroma (feat. Daniel Caesar),imperfect for you,Talk,Bluest Flame,Headphones On,Clearblue,dandelion,Bruises Off The Peach,I Wasn’t There,Some Protector,Sunshine & Rain...,The Subway,opposite,...Ready For It?
18,IV. Sweatpants,Big Brother,"Feels (feat. Pharrell Williams, Katy Perry & Big Sean)",Love$ick (feat. A$AP Rocky),Gucci Flip Flops (feat. Lil Yachty),Be Careful,Violent Crimes,I Might Need Security,Happier,Where This Flower Blooms (feat. Frank Ocean),Jingle Bell Rock,i,SWEET,Taking A Walk,Eyes,Boredom (feat. Rex Orange County & Anna of the North),Icon,PUPPET,B.B. Belt,Feel Something Again,Fireflies (Outro),NASA,Feel Something Again,Lucid Dreams,Doomsday,everything i wanted,Chucky Cheese,Put Your Records On,It Gets Better,Chanel,SMUCKERS (feat. Lil Wayne & Kanye West),shining on my ex,Knock Knock,Sober,Put Your Records On,New Light,Pluto Projector,Je te veux,I Am (feat. Flo Milli),The Weekend,Knock Knock,Pluto Projector,Why Didn't You Stop Me?,LEMONHEAD (feat. 42 Dugg),Mood Ring,Domo23,Rusty (feat. Domo Genesis & Earl Sweatshirt),Sparks Fly,telepatía,Nothing New (feat. Phoebe Bridgers) (Taylor’s Version) (From The Vault),LEMONHEAD (feat. 42 Dugg),The Other Side Of The Door (Taylor’s Version),Vamp Anthem,WHAT'S GOOD,Perfect Places,Tennis Court,Perfect Places,EARFQUAKE,Snow On The Beach (feat. Lana Del Rey),All I Need To Hear,Punisher,There Is a Light That Never Goes Out - 2017 Master,Boy's a liar Pt. 2,LEMONHEAD (feat. 42 Dugg),Graceland Too,The Last Time (feat. Gary Lightbody of Snow Patrol) (Taylor’s Version),In My Life - Remastered 2009,Attracted to You,Night Shift,WHARF TALK (feat. A$AP Rocky),Sidelines,The Gold - Phoebe Bridgers Version,tolerate it,Cartwheel,Hot & Heavy,Deeper Well,HOT TO GO!,Turn it up,Risk,Sandpaper (feat. Bruce Springsteen),Movin' Out (Anthony's Song),28,28,Take A Bite,don't wanna break up again,St. Chroma (feat. Daniel Caesar),Balloon (feat. Doechii),Greedy,Reason Why,Current Affairs,Some Protector,Fame is a Gun,New York,Little Faith,ballad of a homeschooled girl,Picture To Burn,Appetite,Melting
19,No Romance,8TEEN,Chill Bill (feat. J. Davi$ & Spooks),Distance,Love$ick (feat. A$AP Rocky),All Mine,Bubblin,Jackie Chan,Baby Blue (feat. Chance the Rapper),chateau,Holly Jolly Christmas,White Iverson,BLEACH,Lean Wit Me,Caroline,Patty Cake,See You Again (feat. Kali Uchis),November,Timeless,"Gotta Go My Own Way - From ""High School Musical 2""/Soundtrack Version",LOVE. FEAT. ZACARI.,needy,Gives You Hell,Honest - Tritonal Remix,Allergic,Kraazy,Nothing from Nothing - Recorded at Spotify Studios NYC,3 Nights,Novacane,Baby Blue (feat. Chance the Rapper),Money Trees,Mariposa,Wouldn't Leave,Freak,Brutal Earthquake,Small Worlds,Mind Over Matter,REEL IT IN,Summertime In Paris,LOVE. FEAT. ZACARI.,"After The Storm (feat. Tyler, The Creator & Bootsy Collins)",Sheila,Sheila,SWEET / I THOUGHT YOU WANTED TO DANCE (feat. Brent Faiyaz & Fana Hues),Does Your Mother Know,Joyride,SWEET / I THOUGHT YOU WANTED TO DANCE (feat. Brent Faiyaz & Fana Hues),champagne problems,Sparks Fly,Bubblin,ARE WE STILL FRIENDS?,The Path,New Romantics,Tennis Court,Cash In Cash Out,THREAT,Bravado,Paris,400 Lux,Day After Tomorrow,Savior Complex,Tim McGraw,the lakes - bonus track,About You,Should've Said No,Crush - Stripped,Mine (Taylor's Version),I'm On Fire,Melting,love is embarrassing,Crush - Stripped,Paris,VBS,I Won't Share You - 2011 Remaster,Letter To An Old Poet,My Boy Only Breaks His Favorite Toys,I Can Do It With a Broken Heart,Found Heaven,DOGTOOTH,Born in the U.S.A.,Beast Of Burden - Remastered 1994,Supercut,Tomorrow,"Girl, so confusing featuring lorde",Add Up My Love,Bad Reviews,MAYBE,Best Guess,My Favorite Part,Some Protector,twilight zone,Bus Back To Richmond,House Tour,Headphones On,High Fashion,The Smallest Man Who Ever Lived,Always Willin',10% (feat. Kali Uchis)
20,Rolex,Swang,Magnolia,Pursuit Of Happiness (Nightmare),Playinwitme (feat. Kehlani),Chill Bill (feat. J. Davi$ & Spooks),Playinwitme (feat. Kehlani),Feel The Love,iSpy (feat. Lil Yachty),SMUCKERS (feat. Lil Wayne & Kanye West),Rockin' Around The Christmas Tree,Caroline,Violent Crimes,different hos,"break up with your girlfriend, i'm bored",XXX. FEAT. U2.,Sunflower,I Ain't Got Time!,Ballin Flossin,in my head,SAD!,iSpy (feat. Lil Yachty),Ballin Flossin,Malibu,shining on my ex,ROXANNE,Salad Days,EARFQUAKE,White Iverson,EARFQUAKE,Baby Blue (feat. Chance the Rapper),Magic In The Hamptons (feat. Lil Yachty),NEW MAGIC WAND,Small Worlds,Watermelon Sugar,Brutal Earthquake,Put Your Records On,3005,Weekend (feat. Miguel),EARFQUAKE,"Sunflower, Vol. 6",Payday (feat. Young Thug),CORSO,Ain't Shit,Slater (feat. Frank Ocean),National Anthem,Chinese Satellite,The Very First Night (Taylor's Version) (From The Vault),EARFQUAKE,Secrets from a Girl (Who's Seen it All),Dear John,Glitter,Need to Know,"GONE, GONE / THANK YOU",Supercut,Bravado,Domo23,Lavender Haze,ARE WE STILL FRIENDS?,A World Alone,Nonsense,Better Than Revenge,Halloween,I'm In Love With You,Out Of The Woods,Candy,Night Shift,400 Lux,$20,Foolish One (Taylor’s Version) (From The Vault),Voyager,FTCU,Voyager,Margaret (feat. Bleachers),"I miss you, I’m sorry",I Hate It Here,The Black Dog,Picture You,Useless,Chemical Sunset,Sailor Song,The Smallest Man Who Ever Lived,I Used To Hate My Body But Now I Just Hate You,Close To You,Ankles,Take Your Mask Off (feat. Daniel Caesar & LaToiya Williams),I Know The End,warm,"Henry, come on","At The Beach, In Every Life",goodnight n go,Favourite Daughter,Money is Everything,House Tour,dandelion,The Melting,Sundown Girls,seven
21,See You Again (feat. Kali Uchis),Transportin',Wanted You (feat. Lil Uzi Vert),BLEACH,KOD,JAPAN,Stay,Nice For What,Taste (feat. Offset),Worst,You & Me,Pursuit Of Happiness (Nightmare),Stir Fry,One Night,I Like It,Violent Crimes,Guatemala - From Swaecation,I DON'T LOVE YOU ANYMORE,Prom,NASA,A BOY IS A GUN*,Circles,Erase Me - Main,Novacane,Where You Are,Allergic,shining on my ex,"After The Storm (feat. Tyler, The Creator & Bootsy Collins)",Icon,iSpy (feat. Lil Yachty),Partners in Motion,Love$ick (feat. A$AP Rocky),"break up with your girlfriend, i'm bored",Watermelon Sugar,May I,KEEP DA O'S (feat. Pharrell Williams & Coco O.),2 Pretty Best Friends,Pothole (feat. Jaden Smith),i feel bad,Knock Knock,Plain Jane REMIX (feat. Nicki Minaj),Remember My Name,Supercut,Writer In The Dark,Secrets from a Girl (Who's Seen it All),Reason,Don't Look Back In Anger,Savior Complex,Super Rich Kids,Superman,Mr. Perfectly Fine (Taylor’s Version) (From The Vault),Tia Tamera (feat. Rico Nasty),Keep Driving,Picture To Burn,Norman fucking Rockwell,Norman fucking Rockwell,Stay Stay Stay (Taylor's Version),Maroon,Should've Said No,Looking For Somebody (To Love),The Gold - Phoebe Bridgers Version,I Know The End,Broken Clocks,Buyer's Remorse (feat. Omar Apollo),Taco Truck x VB,Swim Good,Timeless (Taylor’s Version) (From The Vault),Bite The Hand,That Funny Feeling,La La Land (feat. Nita Strauss) - Rock Version,Treacherous (Taylor's Version),Nonbeliever,willow,Die A Happy Man,Christine,About You,Pink Pony Club,Pink Pony Club,Red Wine Supernova,Revival,Cemetry Gates - 2017 Master,Blowing Smoke,Like Him (feat. Lola Young),fake smile,Lonesome,Defying Gravity - Edit,How Bad Do U Want Me,Movie Scene,Fuzzy Feeling,Merry Go 'Round,"Sally, When The Wine Runs Out",Current Affairs,Nettles,Nettles,Tornado Warnings,Endlessly,I know it won't work,Night Shift
22,X (feat. Future),Mr. Clean,Patty Cake,Honest - Tritonal Remix,BOOGIE,Bubblin,Boredom (feat. Rex Orange County & Anna of the North),4th Dimension,In My Blood,Electric (feat. Khalid),Be Careful,Baby Blue (feat. Chance the Rapper),Guatemala - From Swaecation,Thotiana,Blinds,Falling Down - Bonus Track,I Like It,Who Dat Boy (feat. A$AP Rocky),Eternal,"thank u, next",Electric (feat. Khalid),Baby Blue (feat. Chance the Rapper),Dreams - 2004 Remaster,It Wasn't Me,Reasons,Where You Are,everything i wanted,Best Friend,How You Feel,XXX. FEAT. U2.,XXX. FEAT. U2.,3 Nights,Homemade Dynamite,Borderline,Adore You,Green Light,Roaring 20s,Ninety,I Love You Always Forever,Best Friend,Super Rich Kids,RISE! (feat. DAISY WORLD),Fifteen (Taylor’s Version),t r a n s p a r e n t s o u l feat. Travis Barker,Ribs,The Man with the Axe,Picture To Burn,Mean,Kyoto,Tamale,Supercut,Mr. Perfectly Fine (Taylor’s Version) (From The Vault),Our Song,A BOY IS A GUN*,Stay Stay Stay (Taylor's Version),Glory And Gore,Cowboy Casanova,Midnight Rain,Sweet Nothing,Anti-Hero,Moon Song,State Of Grace (Taylor's Version),Munch (Feelin’ U),NEW MAGIC WAND,Mary's Song (Oh My My My),...Ready For It?,Superman (Taylor’s Version),Born To Die,Never Can Say Goodbye (Glee Cast Version),Cherry Wine,True Blue,Voyager,Cartwheel,I know it won't work,Chapstick,I Remember Everything (feat. Kacey Musgraves),Sweet!,Better Man (Taylor's Version) (From The Vault),Born in the U.S.A.,Ever You're Gone,No One Needs To Know,Sandpaper (feat. Bruce Springsteen),bad idea,Slim Pickins,Slow Dance,Tomorrow,The Giver,What Was That,Dandelion,bad idea,Hampstead,Cartwheel,Tempest,SUPERMODEL,goodnight n go,The Wicked Witch of the East,so american,Nonsense
23,Xanarchy,"2SEATER (feat. Aaron Shaw, Samantha Nelson & Austin Feinstein)",Feels Great (feat. Fetty Wap & CVBZ),BBO (Bad Bitches Only),Spice Girl,Sunflower,Foreword (feat. Rex Orange County),WAKE UP,LOVE. FEAT. ZACARI.,BBO (Bad Bitches Only),"Gotta Go My Own Way - From ""High School Musical 2""/Soundtrack Version",3005,Chill Bill (feat. J. Davi$ & Spooks),The Way Life Goes (feat. Oh Wonder),Warm Water - Snakehips Remix,Bubblin,PUPPET,Where This Flower Blooms (feat. Frank Ocean),Hot Shower,bad idea,Dreams - 2004 Remaster,Bubblin,EARFQUAKE,Swang,The Love Club,Best Friend,Say My Name,HeadBand (feat. 2 Chainz) - Coucheron Remix,Ocean Man,Topanga,Nightmare,"After The Storm (feat. Tyler, The Creator & Bootsy Collins)",ARE WE STILL FRIENDS?,Malibu,Landslide,"break up with your girlfriend, i'm bored",SAD!,Nights,"34+35 Remix (feat. Doja Cat, Megan Thee Stallion) - Remix",Sunflower,Ocean Man,Normal Girl,First Love / Late Spring,You Right,LEMONHEAD (feat. 42 Dugg),Slipping Through My Fingers,Red (Taylor's Version),All Too Well (10 Minute Version) (Taylor's Version) (From The Vault),PUPPET,Azucar,Domo23,"After The Storm (feat. Tyler, The Creator & Bootsy Collins)",Mary's Song (Oh My My My),1979 - Remastered 2012,WHAT'S GOOD,Hold No Grudge - Bonus Track,A BOY IS A GUN*,"GONE, GONE / THANK YOU",Supercut,Why Do You Feel So Down,Sunshine (feat. Fousheé),Vroom Vroom,cardigan,HEAVEN TO ME,Breathe (feat. Colbie Caillat) (Taylor’s Version),Creep (Glee Cast Version),Angel (From Barbie The Album),Good Form,American Teenager,That’s When (feat. Keith Urban) (Taylor’s Version) (From The Vault),$20,When We Are Together,Night Shift,True Blue,Happiness,The Tortured Poets Department,Feather,I Can Do It With a Broken Heart,Shotput,Uptown Girl,Here Comes Your Man,Tough Love,Revival,"break up with your girlfriend, i'm bored",Defying Gravity,Juna,"I Love You, I'm Sorry - Live From Vevo",High Fashion,Death Wish - Live from The O2 Arena,Angels All Around Me…,"At The Beach, In Every Life",Thirst Trap,goodnight n go,Illegally Blonde,Headphones On,No Place Like Home,Vicious,Say Yes To Heaven
24,Drowning (feat. Kodak Black),Wanted You (feat. Lil Uzi Vert),Rollin (feat. Future & Khalid),Baby Blue (feat. Chance the Rapper),This Is America,BOOGIE,All Mine,Flamingo,Praise The Lord (Da Shine) (feat. Skepta),Pursuit Of Happiness (Nightmare),Guatemala - From Swaecation,G.O.M.D.,STOP TRYING TO BE GOD,Baby Blue (feat. Chance the Rapper),Chill Bill (feat. J. Davi$ & Spooks),It's A Vibe,JAPAN,"Enjoy Right Now, Today",The Big Day,ghostin,STOP TRYING TO BE GOD,Fireflies (Outro),Lalala,White Iverson,"Sunflower, Vol. 6",Put Your Records On,A Whole New World,Gassed Up,Feel Something Again,Sunflower,How You Feel,STOP TRYING TO BE GOD,RUNNING OUT OF TIME,Mariposa,Self Care,Feels Like We Only Go Backwards,Shoota (feat. Lil Uzi Vert),New Light,In My Room,The Spins,The Weekend,Drew Barrymore,Liquid Smooth,She's A Rainbow,Stoned at the Nail Salon,Apples,Red,Last Valentines,Colossus,Last Kiss,Won't Bite (feat. Smino),She Wants My Money,RUNNING OUT OF TIME,PUPPET,Cold As You,Green Light,Cruel Summer,Cowboy Casanova,Ribs,Starlight (Taylor's Version),Motion Sickness,Speak Now,Good Days,Low,Radio,DOGTOOTH,Haunted (Taylor's Version),Cool About It,Letter To An Old Poet,Hold No Grudge - Bonus Track,Our Song,Sober,First Time,Graceland Too,Not Strong Enough,Hot & Heavy,Too Good to be True,Orange Juice,Peter,Too Good to be True,Good Graces,Take Your Mask Off (feat. Daniel Caesar & LaToiya Williams),Good Graces,There I Said It,Sexy to Someone,luther (with sza),Kitchen,intro (end of the world) - extended,drive ME crazy!,In The Rain,Money is Everything,"Henry, come on",My Favorite Part,"Oh, Gemini",Wet Hair,For Good,South and Pine,Shirt
25,No Heart,Jocelyn Flores,No Romance,Doomsday,Flex Season,BLEACH,Droppin' Seeds (feat. Lil' Wayne),BUTTERFLY EFFECT,NC-17,SAD!,Playinwitme (feat. Kehlani),Young Dumb & Broke,I Like It,Roses (with Juice WRLD feat. Brendon Urie),ghostin,Love$ick (feat. A$AP Rocky),KOD,"2SEATER (feat. Aaron Shaw, Samantha Nelson & Austin Feinstein)",Outro,imagine,5% TINT,BBO (Bad Bitches Only),"GONE, GONE / THANK YOU",I. The Worst Guys,Watermelon Sugar,NONSENSE,Karma Chameleon,Chanel,Violent Crimes,Sunday Best,In My Room,KEEP DA O'S (feat. Pharrell Williams & Coco O.),Rain On Me (with Ariana Grande),Phone Light Up,Stars Are Blind,Crazy,"Sunflower, Vol. 6","Mrs. Robinson - From ""The Graduate"" Soundtrack",After Party,Nights,The Climb,MOMMA TALK,Homemade Dynamite - REMIX,Leader of a New Regime,Me and My Husband,Passion,Wildflower Wildfire,PUPPET,WHAT'S GOOD,champagne problems,BUFFALO (feat. Shane Powers),Our Song,Domo23,Brown Eyed Girl,Domo23,Picture in My Mind,4EVER,4EVER,my tears ricochet,Hard Feelings/Loveless,"Would've, Could've, Should've",ICU,favorite crime,PUPPET,Renegade,Run Joey Run (Glee Cast Version) (feat. Jonathan Groff),Never Grow Up (Taylor's Version),"BOYFRIEND, GIRLFRIEND (2020 Demo) (feat. YG)",Good Form,logical,I'm Your Man,Addictions,Motion Sickness,Something Like That,Fallingforyou,love is embarrassing,"Floaroma Town (From ""Pokémon Diamond & Pearl"")",Winner,exes,Conquer The Heart,Slim Pickins,I Hope You Find Your Way Home,I Hope You Find Your Way Home,Sexy to Someone,Tomorrow,Feather,Lonesome,The Giver,Aquamarine,bet u wanna,Fuzzy Feeling,Chateau,Type Dangerous,Midnight Sun,Close To You,Some Protector,F2F,Silly Love Songs
26,Caroline,Young Dumb & Broke,PICK IT UP (feat. A$AP Rocky),Magnolia,KEKE,Campfire,Garden Shed (feat. Estelle),5% TINT,BBO (Bad Bitches Only),Fireflies (Outro),Caroline,Christmas (Baby Please Come Home),You & Me,Love$ick (feat. A$AP Rocky),in my head,OTW,Good Day,Droppin' Seeds (feat. Lil' Wayne),Zanies and Fools,fake smile,NUMB,Panini,Catch & Release - Deepend Remix,Young Dumb & Broke,Control - Freestyle,Circles,Say So,ROXANNE,EARFQUAKE,STOP TRYING TO BE GOD,Pockets Bigger,Ghost Town,See You Again (feat. Kali Uchis),New Light,November,Knock Knock,TROLLZ (with Nicki Minaj),Self Care,BEST INTEREST,Robbery,EARFQUAKE,Pothole (feat. Jaden Smith),Mr. Perfectly Fine (Taylor’s Version) (From The Vault),Get Into It (Yuh),American Boyfriend,Break It Off - Bonus,Working for the Knife,Azucar,American Boyfriend,Tuned In Freestyle,Love My Way,SWEET / I THOUGHT YOU WANTED TO DANCE (feat. Brent Faiyaz & Fana Hues),NEW MAGIC WAND,Crimson and Clover,Sober II (Melodrama),Writer In The Dark,Green Light,400 Lux,Graceland Too,Picture To Burn,Vroom Vroom,Question...?,Invincible (feat. Daniel Caesar),Happiness,A Place in this World,Radio,Don't Rain On My Parade - Cover of Barbra Streisand's Funny Girl,"GONE, GONE / THANK YOU",WHARF TALK (feat. A$AP Rocky),Richie,Can’t Catch Me Now - from The Hunger Games: The Ballad of Songbirds & Snakes,Silk Chiffon,love is embarrassing,Die From A Broken Heart,stranger,True Blue,I know it won't work,Across the Universe,Please Please Please,Feels Like,opposite,Revival,family ties (with Kendrick Lamar),"I Love You, I'm Sorry",Kitchen,making the bed,Juno,drive ME crazy!,Kitchen,twilight zone,Prisoner,Headphones On,For Keeps,Death Wish - Live from The O2 Arena,opposite,Headphones On,If They Come Lookin',Paradise By The Dashboard Light (Glee Cast Version)
27,Stir Fry,HARI KARI,Gassed Up,Passionfruit,LOVE. FEAT. ZACARI.,Caroline,I Thought About Killing You,NC-17,Jackie Chan,"After The Storm (feat. Tyler, The Creator & Bootsy Collins)",I Like It,Winter Wonderland,OTW,Passionfruit,NASA,Feel Something Again,Rider,Glitter,La Valse d'Amélie - Version piano,needy,See You Again (feat. Kali Uchis),Say My Name,Panini,Caroline,Nothing from Nothing - Recorded at Spotify Studios NYC,Chanel,Kraazy,Wouldn't Leave,Peace of Mind,Put Your Records On,In The Party,Icon,Plain Jane REMIX (feat. Nicki Minaj),Perfect Places,Summertime In Paris,Slater (feat. Frank Ocean),Valerie - '68 Version,Stan,Falling Down - Bonus Track,Summertime In Paris,Sunflower,Washing Machine Heart,Imagine,Why Didn't You Stop Me?,"After The Storm (feat. Tyler, The Creator & Bootsy Collins)",Nineteen,Miserable America,Dealer,Back To December,Need to Know,Buzzcut Season,Death By A Thousand Cuts,"OPEN A WINDOW (feat. Tyler, The Creator)",This Love (Taylor’s Version),Tennis Court,Malibu 1992,Supercut,favorite crime,EARFQUAKE,The 1975,Georgia,The Man,Blame It on the Boogie,Part Of The Band,The Other Side Of The Door (Taylor’s Version),Late Night Talking,Sparks Fly (Taylor’s Version),Satanist,Graceland Too,Don't Rain On My Parade - Cover of Barbra Streisand's Funny Girl,Cold As You,Renegade,Treacherous (Taylor's Version),We're In Love,Cool About It,Better Man (Taylor's Version) (From The Vault),I Remember Everything (feat. Kacey Musgraves),Northern Attitude,Dead Of Night,Little Freak,family ties (with Kendrick Lamar),Uptown Girl,imperfect for you,Red Wine Supernova,White Ferrari,Kitchen,Ivy,Girl at the Station,Merry Go 'Round,Aquamarine,"Sticky (feat. GloRilla, Sexyy Red & Lil Wayne)",Chelsea,party 4 u,CANCELLED!,Red Wine Supernova,Thirst Trap,Kyoto,Slow Burn
28,Magnolia,1-800-273-8255,I Feel It Coming,Killamonjaro,XXX. FEAT. U2.,Fireflies (Outro),Worst,NO BYSTANDERS,Kids See Ghosts,iSpy (feat. Lil Yachty),BOOGIE,Blue Christmas,Sunflower,Without Me (with Juice WRLD),bloodline,Blinds,Pothole (feat. Jaden Smith),How You Feel,Don't,SUGAR,Internet,Lalala,A BOY IS A GUN*,"Feels (feat. Pharrell Williams, Katy Perry & Big Sean)",Salad Days,Tamale,Like That (feat. Gucci Mane),Topanga,Magic In The Hamptons (feat. Lil Yachty),"After The Storm (feat. Tyler, The Creator & Bootsy Collins)",Peace of Mind,XXX. FEAT. U2.,Never Had The Balls,Crazy,i feel bad,Stars Are Blind,Why,Set the Controls for the Heart of the Sun (Live at Pompeii) [2016 Remix],SKELETONS,It Gets Better,Riot!,RUNITUP (feat. Teezo Touchdown),20 Something,Liability,Don't Mess With My Man (feat. Brian Casey & Brandon Casey),Noticed I Cried,enough for you,The Love Club,The Path,Fire In The Sky,Never Tear Us Apart,The Very First Night (Taylor's Version) (From The Vault),Super Rich Kids,Forever & Always (Taylor’s Version),Daydreaming,Supercut,I DON'T LOVE YOU ANYMORE,I'm Like A Bird,Hold No Grudge - Bonus Track,Superman,Liquorice,Paper Rings,I Did Something Bad,Happy Now,"BOYFRIEND, GIRLFRIEND (2020 Demo) (feat. YG)",When We Are Together,Innocent (Taylor's Version),Venice Bitch,I Know The End,Stay Down,Not Strong Enough,Chemtrails Over The Country Club,Graceland Too,greedy,get him back!,Who’s Afraid of Little Old Me?,obsessed,The Entertainer,Turn it up,"Good Luck, Babe!",Sharpest Tool,Cool,fake smile,supernatural,in my head,Seigfried,"Everywhere, Everything (with Gracie Abrams)",Sports car,Cartwheel,Sue me,bad idea,Letter To An Old Poet,American Teenager,Camden,stranger,Bruises Off The Peach - Live Performance,Hot & Heavy,Say Don't Go (Taylor's Version) (From The Vault)
