29,REDMERCEDES,Boredom (feat. Rex Orange County & Anna of the North),"Flex (Ooh, Ooh, Ooh)",See You Again (feat. Kali Uchis),PRBLMS,Deadtalks,Wouldn't Leave,CAN'T SAY,WAKE UP,Baby Blue (feat. Chance the Rapper),SWEET,It's Beginning to Look a Lot like Christmas,Icon,Slide (feat. Frank Ocean & Migos),fake smile,Caroline,G.O.M.D.,IGOR'S THEME,"Married Life (from ""Up"") [Piano Version]",I Like It,I'm Gonna Be,Worst,Do You Remember,Broccoli (feat. Lil Yachty),SUGAR,Doomsday,Panic Room,Don't Wanna Fall In Love,STOP TRYING TO BE GOD,BOOGIE,Put Your Records On,Don't Wanna Fall In Love,NONSENSE,Landslide,Malibu,Sensitive,Snowman,Slater (feat. Frank Ocean),YOSEMITE,Homemade Dynamite,A BOY IS A GUN*,Once More to See You,Green Light,RISE! (feat. DAISY WORLD),Brutal Earthquake,"After The Storm (feat. Tyler, The Creator & Bootsy Collins)",I Bet You Think About Me (feat. Chris Stapleton) (Taylor’s Version) (From The Vault),Buzzcut Season,WUSYANAME (feat. Youngboy Never Broke Again & Ty Dolla $ign),Starlight (Taylor's Version),Who Dat Boy (feat. A$AP Rocky),Haunted,Stoned at the Nail Salon,I Think He Knows,"GONE, GONE / THANK YOU",Mariners Apartment Complex,Television / So Far So Good,Magnets,The Ending,champagne problems,The Truck Got Stuck,In Ha Mood,All Of The Girls You Loved Before,I Know The End,Change (Taylor’s Version),SORRY NOT SORRY,How to disappear,Foolish One (Taylor’s Version) (From The Vault),Aeroplanes,Letter To An Old Poet,Cool About It,Perfect Places,TOOTIMETOOTIMETOOTIME,Triple Dog Dare,Part Of The Band,Feather,"Everywhere, Everything (with Gracie Abrams)",Shotput,Trouble,Best Part (feat. H.E.R.),Sweet Life,Would That I,Nomad,Rah Tah Tah,luther (with sza),we can't be friends (wait for your love),Ankles,luther (with sza),Greedy,Times Like These,For Keeps,Crush,Greedy,White Teeth,so american,The Black Dog,Money is Everything,Somebody Like You
30,Gucci Gang,Bank Account,X (feat. Future),X (feat. Future),Plain Jane,Irreplaceable,Deadtalks,HOUSTONFORNICATION,Mo Bamba,Ghost Town,Warm Water - Snakehips Remix,Mistletoe,See You Again (feat. Kali Uchis),Landslide,Stir Fry,Gucci Flip Flops (feat. Lil Yachty),I. The Worst Guys,Caroline,What I Wouldn't Do,7 rings,Myself,Electric (feat. Khalid),Walk Man,Good Day,everything i wanted,Where This Flower Blooms (feat. Frank Ocean),Beauty And A Beat,Sunday Best,"GONE, GONE / THANK YOU",Love$ick (feat. A$AP Rocky),Irreplaceable,Super Rich Kids,EARFQUAKE,Self Care,me & ur ghost,Self Care,Honey,Sum of My Cares,Armed And Dangerous,Supermodel,Sweet Creature,Alone,Don't Mess With My Man (feat. Brian Casey & Brandon Casey),Ribs,The Winner Takes It All,Summer's End - Spotify Singles,Dealer,Red (Taylor's Version),Ribs,The Way I Loved You (Taylor’s Version),All Too Well (10 Minute Version) (Taylor's Version) (From The Vault),EARFQUAKE,Solar Power,I DON'T LOVE YOU ANYMORE,Grapejuice,The Path,Tennis Court,‘tis the damn season,The Louvre,I'm In Love With You,champagne problems,Cruel Summer,A&W,Hold No Grudge - Bonus Track,Superstar (Taylor’s Version),10% (feat. Kali Uchis),Last Kiss (Taylor's Version),That’s When (feat. Keith Urban) (Taylor’s Version) (From The Vault),Attracted to You,pretty isn’t pretty,ballad of a homeschooled girl,I Know The End,Garden Song,Hey Stephen (Taylor’s Version),Sweet,Eventually,My Kink Is Karma,Tourniquet,28,Satellite,Dumb & Poetic,Bed Chem,Femininomenon,needy,Vicious,Beaches,gold rush,we can't be friends (wait for your love),Last Goodbye,Diet Pepsi,Angels All Around Me…,Tempest,"Oh, Gemini",Type Dangerous,Paradise By The Dashboard Light (Glee Cast Version),Kitchen,"Down, Down, Stream",Sun Bleached Flies
31,MotorSport,Angels,It's A Vibe,"Enjoy Right Now, Today",the ends,OTW,Chill Bill (feat. J. Davi$ & Spooks),SKELETONS,Yes Indeed,SICKO MODE,Sunflower,Let It Snow! Let It Snow! Let It Snow! (with The B. Swanson Quartet),Playinwitme (feat. Kehlani),How You Feel,7 rings,I Like It,Fireflies (Outro),Sometimes...,Stuff We Did,About You Now,NC-17,Dreams - 2004 Remaster,Bubblin,Break Up Every Night,It's Not The Same Anymore,The Love Club,She Wolf,Dumb People Out-Breeding Smart People Explains the Pyramids,GRoCERIES,NONSENSE,KEEP DA O'S (feat. Pharrell Williams & Coco O.),NEW MAGIC WAND,Best Friend,Slater (feat. Frank Ocean),"2SEATER (feat. Aaron Shaw, Samantha Nelson & Austin Feinstein)",Borderline,Lie Lie Lie,Summertime In Paris,Who Dat Boy (feat. A$AP Rocky),GRoCERIES,Blinding Lights,"Because Dreaming Costs Money, My Dear",Mean,Payday (feat. Young Thug),"Say It, Just Say It",Waiting Room,Brazil,London Boy,First Love/Late Spring,The Very First Night (Taylor's Version) (From The Vault),WHAT'S GOOD,Domo23,The Sweet Escape,Fifteen (Taylor’s Version),Stargirl Interlude,Liability,Empty,Labyrinth,Chemtrails Over The Country Club,The Great War,Our Song,Message In A Bottle (Taylor's Version) (From The Vault),If This Was A Movie (Taylor’s Version),Moon Song,SORRY NOT SORRY,august,Not Strong Enough,Please Stay,Hold No Grudge - Bonus Track,Famous Last Words (An Ode to Eaters),teenage dream,"BOYFRIEND, GIRLFRIEND (2020 Demo) (feat. YG)",Partner in Crime,Friends In Low Places,Feather,She's Just the Type of Girl,Super Graphic Ultra Modern Girl,Super Graphic Ultra Modern Girl,eternal sunshine,Close To You,Saturday Night's Alright (For Fighting),Juno,Fable,in my head,needy,Rah Tah Tah,15 Minutes,party 4 u,"Flightless Bird, American Mouth",High Fashion,party 4 u,Slipfast,Reason Why,Touching Yourself,As Long As You’re Mine,CARNIVAL,Skin,Sunshine (feat. Fousheé)
32,"2SEATER (feat. Aaron Shaw, Samantha Nelson & Austin Feinstein)",Forecast,Bound 2,Patty Cake,"Flex (Ooh, Ooh, Ooh)",Dubai Shit,BLEACH,ASTROTHUNDER,Yikes,Yikes,Icon,Only Thing I Ever Get For Christmas,Gucci Flip Flops (feat. Lil Yachty),i,"thank u, next",Roses (with Juice WRLD feat. Brendon Urie),Novacane,Tamale,Sun Come Down,Do You Remember,"After The Storm (feat. Tyler, The Creator & Bootsy Collins)",Ballin Flossin,Shiny,GRoCERIES,Timeless,Feel Something Again,Juicy,Icon,Don't Wanna Fall In Love,3 Nights,One Last Time,"GONE, GONE / THANK YOU",Tamale,November,Borderline,Ride,In The Party,The Spins,Waking World,Plain Jane REMIX (feat. Nicki Minaj),All Night (feat. Knox Fortune),EARFQUAKE,Me and My Husband,Kiss Me More (feat. SZA),SWEET / I THOUGHT YOU WANTED TO DANCE (feat. Brent Faiyaz & Fana Hues),Stoned at the Nail Salon,Mood Ring,ARE WE STILL FRIENDS?,Joyride,Forever & Always (Taylor’s Version),Death By A Thousand Cuts,Dominoes,Enchanted,I THINK,Keep Driving,KEEP IT UP,Kyoto,A BOY IS A GUN*,Late Night Talking,Pistol,Sparks Fly,Dear John,Somebody Like You,WHAT A DAY,Mr. Perfectly Fine (Taylor’s Version) (From The Vault),Angel (From Barbie The Album),Part Of The Band,Doin' Time,Ice Slippin,Cate’s Brother,The Louvre,Crush - Stripped,Is It Over Now? (Taylor's Version) (From The Vault),tolerate it,Heart Out,Northern Attitude,Coffee,Trouble,F2F,"Head Over Heels - Dave Bascombe 7"" N.Mix",Sandpaper (feat. Bruce Springsteen),Saturday Night's Alright (For Fighting),There I Said It,We R Who We R,Love Me Not,Take A Bite,"Flightless Bird, American Mouth","Flightless Bird, American Mouth",Solo,Summer Forever,Sugar On My Tongue,Phoebe,Sneakernight - Single Version,Man Of The Year,Amoeba,Better Man (Taylor's Version) (From The Vault),The Melting,My Life
33,Sweet Creature,It's A Vibe,Malibu,"Feels (feat. Pharrell Williams, Katy Perry & Big Sean)",Dubai Shit,Guatemala - From Swaecation,Distance,CAROUSEL,Youth (feat. Khalid),In My Blood,Blinds,Holly Jolly Christmas,Passionfruit,Better Off (Dying),needy,BLEACH,NASA,BOOGIE,The Louvre,Eternal,No Sad No Bad,fake smile,Passionfruit,iSpy (feat. Lil Yachty),Blame,I DON'T LOVE YOU ANYMORE,nursery,I'm About to Cry,Chanel,CITY OF ANGELS,Ocean Man,Baby Blue (feat. Chance the Rapper),Where You Are,White Iverson,Ride,Pothole (feat. Jaden Smith),BLEACH,Unpredictable,Topanga,telepatía,BOOGIE,BEST INTEREST,JUGGERNAUT (feat. Lil Uzi Vert & Pharrell Williams),Remember My Name,Super Trouper,Writer In The Dark,Message In A Bottle (Taylor's Version) (From The Vault),I Bet You Think About Me (feat. Chris Stapleton) (Taylor’s Version) (From The Vault),LEMONHEAD (feat. 42 Dugg),SWEET / I THOUGHT YOU WANTED TO DANCE (feat. Brent Faiyaz & Fana Hues),Untouchable (Taylor’s Version),"GONE, GONE / THANK YOU","jealousy, jealousy",Ribs,champagne problems,Sober,Payday (feat. Young Thug),gold rush,Light Personified,The Louvre,mirrorball,my tears ricochet,The Weekend,When We Are Together,Kyoto,The Spins,Robbers,Revolution 0,Stay Down,American Teenager,The Gold - Phoebe Bridgers Version,Waiting Room,Moon Song,Going Going Gone,The Air That I Breathe - 2008 Remaster,The Air That I Breathe - 2008 Remaster,Picture You,Highway Don't Care,Someone New,Trouble,Espresso,Unfinished,The Chicken in Black,Don’t Smile,Cartwheel,Vicious,supernatural,"Please, Please, Please, Let Me Get What I Want - 2011 Remaster",Stateside,Headphones On,New York,Balloon (feat. Doechii),Don't Tap That Glass / Tweakin',Don't Tap That Glass / Tweakin',How Did It End?,Picture You,March of the Witch Hunters,New Year’s Day
34,1-800-273-8255,Fuck Love,REDMERCEDES,JAPAN,SMUCKERS (feat. Lil Wayne & Kanye West),YAH.,"Gotta Go My Own Way - From ""High School Musical 2""/Soundtrack Version",WHO? WHAT!,YOSEMITE,LOVE. FEAT. ZACARI.,KOD,all my friends,Eyes,Novacane,imagine,One Night,Fast,911 / Mr. Lonely (feat. Frank Ocean & Steve Lacy),Walk (Remix),Hurricane,Legends,SMUCKERS (feat. Lil Wayne & Kanye West),You're Welcome,20 Min,Don't Wanna Fall In Love,Pothole (feat. Jaden Smith),death bed (coffee for your head),Phone Numbers,XXX. FEAT. U2.,Ghost Town,LMK,Location,May I,i feel bad,"GONE, GONE / THANK YOU",Sum of My Cares,Beautiful Boy (Darling Boy) - 2010 Remastered,"Valerie - Live At BBC Radio 1 Live Lounge, London / 2007",Beef FloMix,Do You Remember,Best Friend,Cop Car,Ribs,Sheila,RISE! (feat. DAISY WORLD),Royals,State Of Grace (Taylor's Version),Noticed I Cried,Ours,Just for Me,The Love Club,I Almost Do (Taylor's Version),Long Live,EARFQUAKE,PUPPET,Love Galore (feat. Travis Scott),Venice Bitch,ICU,"You're On Your Own, Kid",Superstar (Taylor’s Version),All Too Well (10 Minute Version) (Taylor's Version) (From The Vault),Did you know that there's a tunnel under Ocean Blvd,There Is a Light That Never Goes Out - 2017 Master,Chinese Satellite,The HampsterDance Song,Robbers,Rush,Taco Truck x VB,Paint The Town Red,Say Don't Go (Taylor's Version) (From The Vault),Liability (Reprise),The Louvre,I Don't Wanna Be Funny Anymore,Bravado,TOOTIMETOOTIMETOOTIME,Guilty as Sin?,If You Wanna,Tough Love,"Everywhere, Everything (with Gracie Abrams)",Selfish,Risk,How Far Will We Take It?,bye,Did It First (with Central Cee),One Of Your Girls,hey now (feat. dody6),For Keeps,"Henry, come on",bad idea,Lost & Found,Tonight,Partner in Crime,Tonight,Sue me,I'm On Fire,ballad of a homeschooled girl,Last Goodbye,SORRY NOT SORRY
35,Baby Blue (feat. Chance the Rapper),Spice Girl,Slide (feat. Frank Ocean & Migos),Caroline,OTW,Tamale,Mr. Clean,COFFEE BEAN,SMUCKERS (feat. Lil Wayne & Kanye West),Blue Velour,BLEACH,Feliz Navidad,Novacane,iSpy (feat. Lil Yachty),Guatemala - From Swaecation,Campfire,Spice Girl,Foreword (feat. Rex Orange County),Slide Around,Blinds,Fuck Love,Allergic,iSpy (feat. Lil Yachty),A BOY IS A GUN*,Never Had The Balls,I Ain't Got Time!,BELIEVE IT,Feel Something Again,Better,How You Feel,"New Person, Same Old Mistakes",Bad Religion,Chanel,"Feels (feat. Pharrell Williams, Katy Perry & Big Sean)",Beautiful Boy (Darling Boy) - 2010 Remastered,Summertime In Paris,Boss Bitch,Watermelon Sugar,Tell Me How (Coca-Cola Commercial),Domo23,Promiscuous,MASSA,LEMONHEAD (feat. 42 Dugg),Green Light,In The Party,Baby Boy,Stay Stay Stay (Taylor's Version),Cruel Summer,Dominoes,Vamp Anthem,You Belong With Me (Taylor’s Version),IGOR'S THEME,Untouchable (Taylor’s Version),Cruel Summer,Get Free,California,Brazil,Brazil,High Infidelity,Sober,Chinese Satellite,Bejeweled,In Waves,ARE WE STILL FRIENDS?,WHARF TALK (feat. A$AP Rocky),Better Than Revenge,Swim Good,White Teeth Teens,ivy,Endlessly,Green Light,Sober II (Melodrama),I Almost Do (Taylor's Version),Memories,Fearless (Taylor’s Version),Letter To An Old Poet,Smile,Tornado Warnings,get him back!,Would That I,Revival,"Head Over Heels - Dave Bascombe 7"" N.Mix","break up with your girlfriend, i'm bored",Stick Season,Terrapin,Pencil Full of Lead,imperfect for you,Solo,intro (end of the world) - extended,For Keeps,bet u wanna,Multiple Endings,drive ME crazy!,Lost Highway,The Black Dog,Summerboy,Miles,Paradise
36,Pothole (feat. Jaden Smith),Patty Cake,Everything I Am,God's Plan,Mr. Tokyo,Stir Fry,Warm Water - Snakehips Remix,R.I.P. SCREW,Nice For What,WHO? WHAT!,Tamale,good day,Blinds,3005,JAPAN,Sunflower,"thank u, next",Fireflies (Outro),Stupid,Thunder,Enemies (feat. DaBaby),SAD!,That's What I Like,Pursuit Of Happiness (Nightmare),Stressed Out,Garden Shed (feat. Estelle),Better Than Me,Panini,Pain 1993 (with Playboi Carti),Gassed Up,Slater (feat. Frank Ocean),Chanel,"Pachelbel: Canon in D Major, P.37",Adore You,"break up with your girlfriend, i'm bored",Malibu,Broken Clocks,What's Going On - Original Single Mix,CAN'T SAY,IFHY (feat. Pharrell),Lucid Dreams,"After The Storm (feat. Tyler, The Creator & Bootsy Collins)",LUMBERJACK,Homemade Dynamite,Flight 22,I Want You,IFHY (feat. Pharrell),Waiting Room,Nothing New (feat. Phoebe Bridgers) (Taylor’s Version) (From The Vault),I Don't Want to Know - 2004 Remaster,Forever & Always (Taylor’s Version),Kiss Me More (feat. SZA),Malibu 1992,Cash In Cash Out,Funeral,Brighter Than The Sun,Cold Heart - PNAU Remix,Talk Too Much,A BOY IS A GUN*,Oh Caroline,Plastic Hearts,Enchanted,Crush - Stripped,Radio,Garden Song,Fearless (Taylor’s Version),Ours (Taylor’s Version),How to disappear,Moon Song,Melting,Supercut,Fishing In The Dark,Cowboy Casanova,Afraid of Heights,True Blue,Stick Season,Kaleidoscope,Blowing Smoke,Oak Island,Motion Sickness,Found Heaven,Tomorrow,bloodline,Cartwheel,Cinnamon Girl,One Short Day,Movie Scene,Falling for a Friend,luther (with sza),"Sally, When The Wine Runs Out",Sneakernight - Single Version,Ankles,Crush,Please Stay,I Wasn’t There,Money is Everything,Honeymoon Avenue,Run Joey Run (Glee Cast Version) (feat. Jonathan Groff)
37,Portland,PICK IT UP (feat. A$AP Rocky),I Got Top in Bikini Bottom (feat. Kg Smokey),Boredom (feat. Rex Orange County & Anna of the North),Watch (feat. Lil Uzi Vert & Kanye West),XXX. FEAT. U2.,Campfire,Ride,WHO? WHAT!,YOSEMITE,Falling Down - Bonus Track,All I Want for Christmas Is You,Fireflies (Outro),G.O.M.D.,Love$ick (feat. A$AP Rocky),Tamale,Stir Fry,Better Off (Dying),4 Quarters In The Black (Skit),VICTOR ROBERTS,Die For Me (feat. Future & Halsey),bloodline,White Iverson,Baby Blue (feat. Chance the Rapper),Ride,"GONE, GONE / THANK YOU",Catch & Release - Deepend Remix,"GONE, GONE / THANK YOU",One Night,White Iverson,Send The Addy,After Party,One Night,me & ur ghost,Babydoll,Why,Brutal Earthquake,Who Dat Boy (feat. A$AP Rocky),Dead To Me,Gucci Flip Flops (feat. Lil Yachty),GRoCERIES,Abbey,Levitating (feat. DaBaby),I Don't Do Drugs (feat. Ariana Grande),Pluto Projector,Why Didn't You Stop Me?,Way It Goes,Axel F,You Belong With Me (Taylor’s Version),Begin Again (Taylor's Version),The Way I Loved You (Taylor’s Version),Stoned at the Nail Salon,"GONE, GONE / THANK YOU",Green Light,Fourth of July,Picture To Burn,Everywhere,Waiting Room,ICU,Run Away With Me,SWEET / I THOUGHT YOU WANTED TO DANCE (feat. Brent Faiyaz & Fana Hues),Getaway Car,Style,Punisher,Lucky,Little Freak,10% (feat. Kali Uchis),Chun-Li,Foolish One (Taylor’s Version) (From The Vault),"BOYFRIEND, GIRLFRIEND (2020 Demo) (feat. YG)",How High?,Stoned at the Nail Salon,Not Strong Enough,This Kiss,Something Like That,The Alchemy,Fast Times,Poolside,You Can Call Me Al,us. (feat. Taylor Swift),Feels Like,Love Him I Don’t,"Girl, so confusing featuring lorde",imperfect for you,BMF,She,Ghost in the Machine (feat. Phoebe Bridgers),Kitchen,California,goodnight n go,drive ME crazy!,VBS,"Sally, When The Wine Runs Out",Ribbons,The Hurtin' Kind,Fast Times,Highway Don't Care,Robbers
38,PRBLMS,No Heart,See You Again (feat. Kali Uchis),BOOGIE,ELEMENT.,Warm Water - Snakehips Remix,"After The Storm (feat. Tyler, The Creator & Bootsy Collins)",I Like It,Too Much To Ask,5% TINT,XXX. FEAT. U2.,out for the night,"After The Storm (feat. Tyler, The Creator & Bootsy Collins)",Lost,Bubblin,"After The Storm (feat. Tyler, The Creator & Bootsy Collins)",BLEACH,Good Day,"Married Life - From Main Street, U.S.A.",Campfire,Circles,in my head,Young Dumb & Broke,Ride,Simulation,EARFQUAKE,Roses - Imanbek Remix,GRoCERIES,ROXANNE,Violent Crimes,ROXANNE,Mr. Brightside,Peace of Mind,Dang! (feat. Anderson .Paak),Sundress,Watermelon Sugar,Cabin Fever,Wonderful Christmastime - Edited Version / Remastered 2011,Deep End,Promiscuous,Swim Good,Levitating (feat. DaBaby),"FUCKING YOUNG / PERFECT (feat. Charlie Wilson, Chaz Bundick, Sydney Bennett & Kali Uchis)",Pluto Projector,Garden Shed (feat. Estelle),SLUGGER (feat. $NOT & slowthai),Crumble,LEMONHEAD (feat. 42 Dugg),Magnolia,"Valentine, Texas",I THINK,Speak Now,deja vu,Mary's Song (Oh My My My),Buzzcut Season,PartyIsntOver/Campfire/Bimmer (feat. Frank Ocean & Laetitia Sadier),Hard Feelings/Loveless,State Of Grace (Taylor's Version),Paris,favorite crime,Dear John,Picture To Burn,Attracted to You,Helen of Troy - Bonus Track,Let The Light In (feat. Father John Misty),If You’re Too Shy (Let Me Know),Long Live (Taylor's Version),10% (feat. Kali Uchis),Don't Rain On My Parade - Cover of Barbra Streisand's Funny Girl,Not Strong Enough,Born To Die,Television / So Far So Good,Chinese Satellite,Moon Song,From Austin,The Trapeze Swinger,Tornado Warnings,Red Wine Supernova,Casual,Pink Skies (feat. Watchhouse),Oak Island,Pink Skies,Last Goodbye,Diet Pepsi,DENIAL IS A RIVER,Solo,Let It Happen,Aquamarine,Busy Woman,"Henry, come on",Don't Tap That Glass / Tweakin',Silver Jubilee,Dandelion,Fame is a Gun,Prisoner,House Tour,Merry Go 'Round,Revolution 0
39,Swang,X (feat. Future),Caroline,Break Up Every Night,Powerglide (feat. Juicy J) - From SR3MM,SMUCKERS (feat. Lil Wayne & Kanye West),Blinds,Blinds,SAD!,STARGAZING,Eyes,a&t,"Never Recover (Lil Baby & Gunna, Drake)",Powerglide (feat. Juicy J) - From SR3MM,Dubai Shit,going down!,Electric (feat. Khalid),That's What I Like,Jealous,We Go High,Staring At The Sun (feat. SZA),Walk Man,i,Swim Good,LOVE. FEAT. ZACARI.,911 / Mr. Lonely (feat. Frank Ocean & Steve Lacy),Heart On Ice,Hey Jessie,Phone Numbers,Super Rich Kids,Novacane,NONSENSE,PUPPET,CITY OF ANGELS,Sunday Best,Thank You,Clouded,You're Gonna Miss Me (2008 Remastered Original Mono LP Version),Sober,Roaring 20s,Captain Hook,Carry Me Out,Sign of the Times,Mr. Perfectly Fine (Taylor’s Version) (From The Vault),Knock Knock,California,I Always Knew,I THINK,Mean,BUFFALO (feat. Shane Powers),"FIND YOUR WINGS (feat. Roy Ayers, Sydney Bennett & Kali Uchis)",Love My Way,Fallen Fruit,Soon You’ll Get Better (feat. The Chicks),Fishing In The Dark,Dealer,Haunted,About You,Empty,gold rush,Funeral,Paris,Bejeweled,Graceland Too,The Way I Loved You (Taylor’s Version),Picture in My Mind,You’re Not Sorry (Taylor’s Version),Graceland Too,Electric Touch (feat. Fall Out Boy) (Taylor’s Version) (From The Vault),Got Me Started,making the bed,Godspeed,Brando,Night Shift,love is embarrassing,The Black Dog,Sweet Dream,The Bolter,She Calls Me Back (with Kacey Musgraves),Orange Juice,Coincidence,Thought I Was Dead (feat. ScHoolboy Q & Santigold),Juno,I know it won't work,The Cut That Always Bleeds,Sometimes,Limerence,Add Up My Love,MAYBE,Hold No Grudge - Bonus Track,Sucka Free,Last Goodbye,Busy Woman,I Wasn’t There,I Can Do It With a Broken Heart,Fame is a Gun,Fast Times,Not Strong Enough
40,Where This Flower Blooms (feat. Frank Ocean),Uber Everywhere,THat Part,Transportin',Deadtalks,Flex Season,No Mistakes,SMUCKERS (feat. Lil Wayne & Kanye West),SICKO MODE,Mo Bamba,Breaking Free,a lot,Tamale,JAPAN,This Is America,Moonlight,Big,Potato Salad,5 Year Plan,"break up with your girlfriend, i'm bored",Goodbyes (feat. Young Thug),EARFQUAKE,Pursuit Of Happiness (Nightmare),Day 'N' Nite (nightmare),Pluto Projector,"Enjoy Right Now, Today",Cyber Sex,How You Feel,3 Nights,Girls from the North,Location,CITY OF ANGELS,"2SEATER (feat. Aaron Shaw, Samantha Nelson & Austin Feinstein)",BLEACH,See You Again (feat. Kali Uchis),Perfect Places,DHL,Zack & Cody (feat. Valee),I Ain't Got Time!,May I,Chanel,Francis Forever,Been Like This,CORSO,Fallen Fruit,Crumble,Washing Machine Heart,Super Rich Kids,The Man with the Axe,Phone Numbers,Should've Been Me,Lover,Maneater,Daydreaming,Picture To Burn,Pain,The Other Side Of The Door (Taylor’s Version),Domo23,Getaway Car,i'm sorry,Drift Away,Sunshine (feat. Fousheé),Cruel Summer,Garden Song,Part Of The Band,Grapejuice,Tied Together with a Smile,Glory And Gore,Cool About It,Good Form,(It's Good) To Be Free - Remastered,I Did Something Bad,Blue,Brando,"Would've, Could've, Should've",Here Comes Your Man,Naked In Manhattan,Norman fucking Rockwell,No One Needs To Know,opposite,Talk talk,The Hurtin' Kind,I know it won't work,28,Judge Judy,Somebody Else - Spotify Singles,Love Me Not,Cartwheel,Hold No Grudge - Bonus Track,Best Guess,Mommanem,Garden Song,Hammer,Sunshine Baby,Hunter,Vicious,The Trapeze Swinger,OKRA
41,Roll in Peace (feat. XXXTENTACION),Rock The Party,HARI KARI,PICK IT UP (feat. A$AP Rocky),Eyes,Powerglide (feat. Juicy J) - From SR3MM,"2SEATER (feat. Aaron Shaw, Samantha Nelson & Austin Feinstein)","After The Storm (feat. Tyler, The Creator & Bootsy Collins)",SKELETONS,NO BYSTANDERS,"After The Storm (feat. Tyler, The Creator & Bootsy Collins)",Stir Fry,U and I,Congratulations,Man Listen,Dreams - 2004 Remaster,needy,Novacane,If I Can't Have You,Stir Fry,I Know,Erase Me - Main,What They Want,Do You Remember,Outro,A BOY IS A GUN*,Panini,shining on my ex,BOOGIE,Do You Remember,Lost,Blinds,Potato Salad,positions,Best Friend,TROLLZ (with Nicki Minaj),Dang! (feat. Anderson .Paak),ball w/o you,Hands,Lost,Don't Stop Me Now,Freak,Domo23,LUMBERJACK,Levitating,"If We Were A Movie - From ""Hannah Montana""/Soundtrack Version",Waterloo,Tamale,Mine,Location,Our Song,Malibu 1992,My Happy Ending,You’re Not Sorry (Taylor’s Version),Satellite,Cold Heart - PNAU Remix,Swingin Party,Stay Stay Stay (Taylor's Version),Give You the World,Stay Stay Stay (Taylor's Version),Never Grow Up,Long Live,Shirt,f a r a w a y,Teardrops On My Guitar - Radio Single Remix,Cool About It,That’s When (feat. Keith Urban) (Taylor’s Version) (From The Vault),Candy,That’s When (feat. Keith Urban) (Taylor’s Version) (From The Vault),Revolution 0,The Last Time (feat. Gary Lightbody of Snow Patrol) (Taylor’s Version),Soak Up The Sun,ballad of a homeschooled girl,Garden Song,Back On The Map,Kiss Me More (feat. SZA),Highway Don't Care,Let It Happen,Forever,obsessed,eternal sunshine,Take A Bite,I Told You Things,Take Your Mask Off (feat. Daniel Caesar & LaToiya Williams),Second Nature,How,Modigliani,Juno,Juno,Lost Highway,Camden,The Longest Goodbye,Hampstead,Friends in Low Places,The Smallest Man Who Ever Lived,Highway Don't Care,Fearless (Taylor’s Version),Rainbow
42,rockstar,"Flex (Ooh, Ooh, Ooh)",God's Plan,Flex Season,Campfire,Eyes,Stir Fry,See You Again (feat. Kali Uchis),4th Dimension,Chicken Fried,Stir Fry,asmr,Campfire,Caroline,Powerglide (feat. Juicy J) - From SR3MM,Gives You Hell,make up,HeadBand (feat. 2 Chainz) - Coucheron Remix,I Got You (Always and Forever),BOY BYE,Saint-Tropez,Pursuit Of Happiness (Nightmare),3005,That's What I Like,Patience,NEW MAGIC WAND,GRoCERIES,,Irreplaceable,Panini,Selfish,Ocean Man,Put Your Records On,Phone Numbers,Baby Blue (feat. Chance the Rapper),Waking World,Dear John,Money Trees,SAD!,Baby Blue (feat. Chance the Rapper),Stars Are Blind,GROUP B,t r a n s p a r e n t s o u l feat. Travis Barker,Supercut,Liquid Smooth,Don't Look Back In Anger,Fallen Fruit,Dear John,Savior Complex,drivers license,Enchanted,Solar Power,EARFQUAKE,Music For a Sushi Restaurant,Cowboy,Cruel Summer,I'm Gonna Getcha Good,All I Need To Hear,betty,Make Me Your Queen,California,The Kiss Of Venus (Dominic Fike),august,Glue Song,Punisher,Savior Complex,Princess Diana (with Nicki Minaj),Favor,I Can See You (Taylor’s Version) (From The Vault),Graceland Too,A Place in this World,Kyoto,ICU,Magnolia,Someone New,bad idea right?,august,Beast Of Burden - Remastered 1994,stranger,Oak Island,"I Love You, I'm Sorry",family ties (with Kendrick Lamar),"I Love You, I'm Sorry",Taste,Saturn Returns Interlude,Taste,Motion Sickness,Ever Seen,Illegal,Vicious,Busy Woman,Free Now,Headphones On,Sunshine & Rain...,New York,"I Love You, I'm Sorry",Friends in Low Places,Swim Good
